372081,,1000120034,香川県三豊市,三豊市文書館 秋期企画展,JA,,,シュウキキカクテン,,https://www.city.mitoyo.lg.jp/section/bunsho/kikaku.html,,三豊市;文書館;アーカイブズ;展示,,,毎年10~11月頃に開催,2023-10-01,2023-11-31,09:00,17:00,開催期間未定,,2022-04-01,2024-03-31,,三豊市文書館の秋期企画展,,,,,三豊市文書館,(0875)63-1010,,,,,,,三豊市文書館,,0038,香川県,三豊市,山本町財田西,375番地,,34.11836753,133.7258325,三豊市コミュニティバス 山本線・財田観音寺線 山本庁舎 下車すぐ,有,無料,,無,,,,,,,,,,,,,,,,,無,無,不可,無,可,,,
372081,,1000120035,香川県三豊市,三豊市文書館 春期企画展「市民と地域を守る ~三豊、消防のあゆみ~」,JA,,,シュンキキカクテン「シミントチイキヲマモル　~ミトヨ、ショウボウノアユミ~」,,https://www.city.mitoyo.lg.jp/section/bunsho/kikaku.html,,三豊市;文書館;アーカイブズ;展示;消防;消防団,,,毎年3~4月に開催,2023-03-11,2023-05-07,09:00,17:00,休館日:月曜、祝日、3月31日(月)、4月28日(金),,2023-03-11,2023-05-07,,操法大会などで毎年優秀な成績を収める三豊市消防団。平成28(2016)年に移転新築された三観広域北消防署。消防団の誕生から北消防署の移転まで、三豊の消防、消防団のあゆみを振り返ります。,,,,,三豊市文書館,(0875)63-1010,,,,,,,三豊市文書館,,0038,香川県,三豊市,山本町財田西,375番地,,34.11836753,133.7258325,三豊市コミュニティバス 山本線・財田観音寺線 山本庁舎 下車すぐ,有,無料,,無,,,,,,,,,,,,,,,,,無,無,不可,無,可,,,
372081,,1000120036,香川県三豊市,文書館こども体験講座「ぶんしょかんの夏休み!」,JA,,,ブンショカンコドモタイケンコウザ「ブンショカンノナツヤスミ!」,,https://www.city.mitoyo.lg.jp/section/bunsho/kikaku.html,,三豊市;文書館;アーカイブズ;講座;体験;子供向け,,,毎年8月下旬に開催,2023-08-24,2023-08-24,14:00,15:30,開催日未定,,2022-04-01,2024-03-31,,三豊市文書館の子ども向け体験講座。紙にまつわる体験講座。,,,,,三豊市文書館,(0875)63-1010,,,,,,,三豊市文書館,,0038,香川県,三豊市,山本町財田西,375番地,,34.11836753,133.7258325,三豊市コミュニティバス 山本線・財田観音寺線 山本庁舎 下車すぐ,有,無料,,無,,,,,,,,,,,,,,,,,無,無,不可,無,可,,,
372081,,1000120037,香川県三豊市,文書館体験講座「はじめての文書館!2023」,JA,,,ブンショカンタイケンコウザ「ハジメテノブンショカン!2023」,,https://www.city.mitoyo.lg.jp/section/bunsho/kikaku.html,,三豊市;文書館;アーカイブズ;講座;体験;,,,毎年6月9日(国際アーカイブズの日)前後に開催,2023-06-09,2023-06-09,14:00,15:30,開催日未定,,2022-04-01,2024-03-31,,三豊市文書館の利用と業務の体験,,,,,三豊市文書館,(0875)63-1010,,,,,,,三豊市文書館,,0038,香川県,三豊市,山本町財田西,375番地,,34.11836753,133.7258325,三豊市コミュニティバス 山本線・財田観音寺線 山本庁舎 下車すぐ,有,無料,,無,,,,,,,,,,,,,,,,,無,無,不可,無,可,,,
372081,,1000120038,香川県三豊市,やまもと爽郷祭り,JA,さっさまつり,,ヤマモトサッサマツリ,,,,,,,毎年10月中旬,,,,,,,,,秋によさこいの熱い乱舞を見ることが出来るイベント,秋によさこいの熱い乱舞を見ることが出来るイベント。地元チームだけでなく、高知など県外のチームも参加する。また、地元の獅子舞や長刀踊りなどの伝統芸能や太鼓台も登場する。,,屋台、よさこい、ステージパフォーマンス、獅子舞、太鼓台等,無料,,財田大野農業構造改善センター,(0875)63-4692,,やまもと爽郷まつり実行委員会 ,,,,,山本ふれあい公園,,0038,香川県,三豊市,山本町財田西,154,,34.12041038,133.7328166,車,,無料,,無,,,,,,,,,,,,,,,,,,,有,,,,,
372081,,1000120039,香川県三豊市,山本町文化祭,JA,山本町文化祭,,ヤマモトチョウブンカサイ,,,,,,,毎年11月に開催,11月上旬の土曜日,11月上旬の日曜日,09:00,20:00,作品展示は通年開催,,,,,山本町の文化祭です。,,文化祭,,,山本町生涯学習センター,(0875)63-1041,,文化協会山本支部,,,一般,,山本町生涯学習センター,,0038,香川県,三豊市,山本町財田西,154,山本町生涯学習センター,34.12022285,133.732399,,,無料,,無,,,,,無料,,,,,,,,,,,,,,,,,,,
372081,,1000120040,香川県三豊市,浦四国八十八ヶ所巡り,JA,,,ウラシコクハチジュウハッカショメグリ,,,,,,,,,,,,,,,,,,,,,,,,,,,,,,,,,香川県,三豊市,,,,,,,,,,無,,,,,,,,,,,,,,,,,,,有,,,,,
372081,,1000120041,香川県三豊市,島四国八十八ヶ所巡り,JA,,,シマシコクハチジュウハッカショメグリ,,,,,,,,,,,,,,,,,,,,,,,,,,,,,,,,,香川県,三豊市,,,,,,,,,,無,,,,,,,,,,,,,,,,,,,有,,,,,
